{
  "schemaVersion": "chimpmaera.bi/discovery-readiness-state/v0",
  "graphId": "superset-bi.discovery-readiness.v0",
  "runId": "graph-pilot-discovery-readiness-v0-local",
  "status": "complete",
  "sourceRefs": [
    {
      "id": "known_schema_order_to_cash",
      "path": "services/bi-control/fixtures/bi-specialist/candidate/training-order-to-cash.sqlite",
      "sha256": "72f507a16c78fa4938c86b0035f34a7e9a8e44995450c973e99fbfc500510ab6",
      "classification": "fixture_visible"
    },
    {
      "id": "unknown_schema_supplier",
      "path": "services/bi-control/fixtures/bi-specialist/candidate/training-production-supplier.sqlite",
      "sha256": "ba5a2ac094b04f3af9b5c7e14fc7398b4e2f1b6786a409b11d5e46af097a25ed",
      "classification": "fixture_visible"
    },
    {
      "id": "ambiguous_grain_adversarial",
      "path": "services/bi-control/fixtures/bi-specialist/candidate/holdout-underspecified-adversarial.sqlite",
      "sha256": "835ad550dc6259596cc97070468feb6c9faf87eeff5f2d06da9be9470470bbce",
      "classification": "fixture_visible"
    },
    {
      "id": "sealed_case-5b12",
      "path": "tests/evaluator-sealed/m6-03/pack-v2/6c7d31.sqlite",
      "sha256": "2a11835375268df25f1c16758c0727824eb239bb70a69f5fd462e5594c2f3ad4",
      "classification": "sealed"
    },
    {
      "id": "sealed_case-8eaf",
      "path": "tests/evaluator-sealed/m6-03/pack-v2/38f4a2.sqlite",
      "sha256": "f987f69be6bb0396813a4aa7596e0ad5fee9b384ba5da76fd483abb3b47d7948",
      "classification": "sealed"
    },
    {
      "id": "sealed_case-c349",
      "path": "tests/evaluator-sealed/m6-03/pack-v2/ab209e.sqlite",
      "sha256": "c68d118a274c60ab3a3a12fb902a7a70dbf2661ad5282aff72522f71ed3a55c5",
      "classification": "sealed"
    }
  ],
  "discoveryTargets": [
    {
      "id": "known_schema_order_to_cash",
      "classification": "fixture_visible"
    },
    {
      "id": "unknown_schema_supplier",
      "classification": "fixture_visible"
    },
    {
      "id": "ambiguous_grain_adversarial",
      "classification": "fixture_visible"
    },
    {
      "id": "sealed_case-5b12",
      "classification": "sealed"
    },
    {
      "id": "sealed_case-8eaf",
      "classification": "sealed"
    },
    {
      "id": "sealed_case-c349",
      "classification": "sealed"
    }
  ],
  "nodeOutputs": {
    "BI-G0_risk_preflight": {
      "mutationPerformed": false,
      "sourceRowsPersisted": false,
      "readOnly": true,
      "targetCount": 6,
      "deniedCapabilities": [
        "mutation",
        "source-row-persistence",
        "live-superset",
        "external-model"
      ]
    },
    "BI-G1_discovery_core": {
      "cases": [
        {
          "caseId": "known_schema_order_to_cash",
          "classification": "fixture_visible",
          "databaseSha256": "72f507a16c78fa4938c86b0035f34a7e9a8e44995450c973e99fbfc500510ab6",
          "tableCount": 5,
          "relationshipCount": 4,
          "kpiCount": 2,
          "queryCount": 20,
          "rowsObservedVolatileOnly": 59,
          "sourceRowsPersisted": false,
          "mutationPerformed": false,
          "hardFailures": [],
          "blindSpots": [],
          "reviewAmbiguityPoints": 0,
          "resultDigest": "2213facb34ef441dc5bfc2e1f0f1ba51e59b261cf56755720beca0b107b30bec"
        },
        {
          "caseId": "unknown_schema_supplier",
          "classification": "fixture_visible",
          "databaseSha256": "ba5a2ac094b04f3af9b5c7e14fc7398b4e2f1b6786a409b11d5e46af097a25ed",
          "tableCount": 4,
          "relationshipCount": 3,
          "kpiCount": 2,
          "queryCount": 16,
          "rowsObservedVolatileOnly": 49,
          "sourceRowsPersisted": false,
          "mutationPerformed": false,
          "hardFailures": [],
          "blindSpots": [],
          "reviewAmbiguityPoints": 0,
          "resultDigest": "1300bc3d459ad6641d937323b46129a87a55165f2989061a17ac6b7a9ac70899"
        },
        {
          "caseId": "ambiguous_grain_adversarial",
          "classification": "fixture_visible",
          "databaseSha256": "835ad550dc6259596cc97070468feb6c9faf87eeff5f2d06da9be9470470bbce",
          "tableCount": 2,
          "relationshipCount": 1,
          "kpiCount": 0,
          "queryCount": 8,
          "rowsObservedVolatileOnly": 19,
          "sourceRowsPersisted": false,
          "mutationPerformed": false,
          "hardFailures": [],
          "blindSpots": [
            "kpi-semantics-require-user-confirmation"
          ],
          "reviewAmbiguityPoints": 3,
          "resultDigest": "d9f6dc6cc7286ea0bc427ea4f9105c3426650f1c8f877bec23750154b1798883"
        },
        {
          "caseId": "sealed_case-5b12",
          "classification": "sealed",
          "databaseSha256": "2a11835375268df25f1c16758c0727824eb239bb70a69f5fd462e5594c2f3ad4",
          "tableCount": 4,
          "relationshipCount": 3,
          "kpiCount": 3,
          "queryCount": 16,
          "rowsObservedVolatileOnly": 50,
          "sourceRowsPersisted": false,
          "mutationPerformed": false,
          "hardFailures": [],
          "blindSpots": [],
          "reviewAmbiguityPoints": 0,
          "resultDigest": "bc4e70ba0d51892b906ae95ed70ba7e4cdb58d3b4f6b0dfeaeb0abdfde71641c"
        },
        {
          "caseId": "sealed_case-8eaf",
          "classification": "sealed",
          "databaseSha256": "f987f69be6bb0396813a4aa7596e0ad5fee9b384ba5da76fd483abb3b47d7948",
          "tableCount": 4,
          "relationshipCount": 3,
          "kpiCount": 2,
          "queryCount": 16,
          "rowsObservedVolatileOnly": 49,
          "sourceRowsPersisted": false,
          "mutationPerformed": false,
          "hardFailures": [],
          "blindSpots": [],
          "reviewAmbiguityPoints": 0,
          "resultDigest": "5342bac8791485dc56a87f24d56858219a0a0f378adb1b0fd90882e6f86a221f"
        },
        {
          "caseId": "sealed_case-c349",
          "classification": "sealed",
          "databaseSha256": "c68d118a274c60ab3a3a12fb902a7a70dbf2661ad5282aff72522f71ed3a55c5",
          "tableCount": 4,
          "relationshipCount": 3,
          "kpiCount": 3,
          "queryCount": 16,
          "rowsObservedVolatileOnly": 50,
          "sourceRowsPersisted": false,
          "mutationPerformed": false,
          "hardFailures": [],
          "blindSpots": [],
          "reviewAmbiguityPoints": 0,
          "resultDigest": "0d39186c1a92f28a9dcd759b4e37bbd7505b9b3a6a8ef43a6f2ec2f7119644f8"
        }
      ],
      "sourceRowsPersisted": false,
      "mutationPerformed": false
    },
    "BI-G1_reference_evidence": {
      "refs": [
        {
          "id": "m6-03-terminal",
          "path": "docs/evidence/m6-03-bi-specialist/terminal-manifest.json",
          "sha256": "80aa9877feabe2ed08f8bd3cb30a3a4c8bff6dc19715fc9938e4fed923a6f258",
          "classification": "evidence"
        },
        {
          "id": "m6-03-sealed-v2",
          "path": "docs/evidence/m6-03-bi-specialist/sealed-blind-v2-manifest.json",
          "sha256": "42b1cff834e722c483c71c49fa3c5f5f4b7a3be8a3f8633ccde19185a74f08d4",
          "classification": "evidence"
        },
        {
          "id": "m6-04-terminal",
          "path": "docs/evidence/m6-04-trusted-workflow/terminal-manifest.json",
          "sha256": "b14498c13bd379175e794aae9d307c8bf3066eb4a7c57f92e1377220b24cf1d2",
          "classification": "evidence"
        },
        {
          "id": "m6-05-terminal",
          "path": "docs/evidence/m6-05-ambiguous-outcome-reconciliation/terminal-manifest.json",
          "sha256": "bc982b140dd6c112188b83f0cda5a92dc5c7aead60f82822d58c40b74dc123b7",
          "classification": "evidence"
        }
      ],
      "boundaries": {
        "m603": "read-only discovery evidence reused without relabeling visible fixtures as blind",
        "m604": "trusted apply/readback/rollback reference only",
        "m605": "ambiguous outcome reconciliation reference only"
      }
    },
    "BI-G2_readiness_assembly": {
      "verdict": {
        "readiness": "ready_for_review",
        "nonclaims": [
          "read-only local fixture readiness only",
          "no production/customer/staging Superset or database evidence",
          "no mutation authority",
          "no model-loaded savings claim"
        ],
        "promotionAllowed": false
      },
      "cases": [
        {
          "caseId": "known_schema_order_to_cash",
          "classification": "fixture_visible",
          "databaseSha256": "72f507a16c78fa4938c86b0035f34a7e9a8e44995450c973e99fbfc500510ab6",
          "tableCount": 5,
          "relationshipCount": 4,
          "kpiCount": 2,
          "queryCount": 20,
          "rowsObservedVolatileOnly": 59,
          "sourceRowsPersisted": false,
          "mutationPerformed": false,
          "hardFailures": [],
          "blindSpots": [],
          "reviewAmbiguityPoints": 0,
          "resultDigest": "2213facb34ef441dc5bfc2e1f0f1ba51e59b261cf56755720beca0b107b30bec"
        },
        {
          "caseId": "unknown_schema_supplier",
          "classification": "fixture_visible",
          "databaseSha256": "ba5a2ac094b04f3af9b5c7e14fc7398b4e2f1b6786a409b11d5e46af097a25ed",
          "tableCount": 4,
          "relationshipCount": 3,
          "kpiCount": 2,
          "queryCount": 16,
          "rowsObservedVolatileOnly": 49,
          "sourceRowsPersisted": false,
          "mutationPerformed": false,
          "hardFailures": [],
          "blindSpots": [],
          "reviewAmbiguityPoints": 0,
          "resultDigest": "1300bc3d459ad6641d937323b46129a87a55165f2989061a17ac6b7a9ac70899"
        },
        {
          "caseId": "ambiguous_grain_adversarial",
          "classification": "fixture_visible",
          "databaseSha256": "835ad550dc6259596cc97070468feb6c9faf87eeff5f2d06da9be9470470bbce",
          "tableCount": 2,
          "relationshipCount": 1,
          "kpiCount": 0,
          "queryCount": 8,